
*** Running vivado
    with args -log system_breath_led_ip_0_0.vds -m64 -product Vivado -mode batch -messageDb vivado.pb -notrace -source system_breath_led_ip_0_0.tcl


****** Vivado v2018.3 (64-bit)
  **** SW Build 2405991 on Thu Dec  6 23:38:27 MST 2018
  **** IP Build 2404404 on Fri Dec  7 01:43:56 MST 2018
    ** Copyright 1986-2018 Xilinx, Inc. All Rights Reserved.

source system_breath_led_ip_0_0.tcl -notrace
INFO: [IP_Flow 19-234] Refreshing IP repositories
INFO: [IP_Flow 19-1700] Loaded user IP repository 'c:/Users/Admin/Desktop/VIVADO_Projects/PS/ip/ip_repo/breath_led_ip_1.0'.
INFO: [IP_Flow 19-2313] Loaded Vivado IP repository 'D:/Xilinx/Vivado/2018.3/data/ip'.
Command: synth_design -top system_breath_led_ip_0_0 -part xc7z020clg484-2 -mode out_of_context
Starting synth_design
Attempting to get a license for feature 'Synthesis' and/or device 'xc7z020'
INFO: [Common 17-349] Got license for feature 'Synthesis' and/or device 'xc7z020'
INFO: Launching helper process for spawning children vivado processes
INFO: Helper process launched with PID 5992 
---------------------------------------------------------------------------------
Starting RTL Elaboration : Time (s): cpu = 00:00:02 ; elapsed = 00:00:02 . Memory (MB): peak = 468.426 ; gain = 95.465
---------------------------------------------------------------------------------
INFO: [Synth 8-6157] synthesizing module 'system_breath_led_ip_0_0' [c:/Users/Admin/Desktop/VIVADO_Projects/PS/ip/user_led.srcs/sources_1/bd/system/ip/system_breath_led_ip_0_0/synth/system_breath_led_ip_0_0.v:57]
INFO: [Synth 8-6157] synthesizing module 'breath_led_ip_v1_0' [c:/Users/Admin/Desktop/VIVADO_Projects/PS/ip/user_led.srcs/sources_1/bd/system/ipshared/9a26/hdl/breath_led_ip_v1_0.v:4]
	Parameter START_FREQ_STEP bound to: 100 - type: integer 
	Parameter C_S01_AXI_DATA_WIDTH bound to: 32 - type: integer 
	Parameter C_S01_AXI_ADDR_WIDTH bound to: 4 - type: integer 
INFO: [Synth 8-6157] synthesizing module 'breath_led_ip_v1_0_S01_AXI' [c:/Users/Admin/Desktop/VIVADO_Projects/PS/ip/user_led.srcs/sources_1/bd/system/ipshared/9a26/hdl/breath_led_ip_v1_0_S01_AXI.v:4]
	Parameter START_FREQ_STEP bound to: 100 - type: integer 
	Parameter C_S_AXI_DATA_WIDTH bound to: 32 - type: integer 
	Parameter C_S_AXI_ADDR_WIDTH bound to: 4 - type: integer 
	Parameter ADDR_LSB bound to: 2 - type: integer 
	Parameter OPT_MEM_ADDR_BITS bound to: 1 - type: integer 
INFO: [Synth 8-226] default block is never used [c:/Users/Admin/Desktop/VIVADO_Projects/PS/ip/user_led.srcs/sources_1/bd/system/ipshared/9a26/hdl/breath_led_ip_v1_0_S01_AXI.v:231]
INFO: [Synth 8-226] default block is never used [c:/Users/Admin/Desktop/VIVADO_Projects/PS/ip/user_led.srcs/sources_1/bd/system/ipshared/9a26/hdl/breath_led_ip_v1_0_S01_AXI.v:372]
INFO: [Synth 8-6157] synthesizing module 'breath_led' [c:/Users/Admin/Desktop/VIVADO_Projects/PS/ip/user_led.srcs/sources_1/bd/system/ipshared/9a26/hdl/breath_led.v:3]
	Parameter START_FREQ_STEP bound to: 100 - type: integer 
INFO: [Synth 8-6155] done synthesizing module 'breath_led' (1#1) [c:/Users/Admin/Desktop/VIVADO_Projects/PS/ip/user_led.srcs/sources_1/bd/system/ipshared/9a26/hdl/breath_led.v:3]
INFO: [Synth 8-6155] done synthesizing module 'breath_led_ip_v1_0_S01_AXI' (2#1) [c:/Users/Admin/Desktop/VIVADO_Projects/PS/ip/user_led.srcs/sources_1/bd/system/ipshared/9a26/hdl/breath_led_ip_v1_0_S01_AXI.v:4]
INFO: [Synth 8-6155] done synthesizing module 'breath_led_ip_v1_0' (3#1) [c:/Users/Admin/Desktop/VIVADO_Projects/PS/ip/user_led.srcs/sources_1/bd/system/ipshared/9a26/hdl/breath_led_ip_v1_0.v:4]
INFO: [Synth 8-6155] done synthesizing module 'system_breath_led_ip_0_0' (4#1) [c:/Users/Admin/Desktop/VIVADO_Projects/PS/ip/user_led.srcs/sources_1/bd/system/ip/system_breath_led_ip_0_0/synth/system_breath_led_ip_0_0.v:57]
WARNING: [Synth 8-3331] design breath_led_ip_v1_0_S01_AXI has unconnected port S_AXI_AWPROT[2]
WARNING: [Synth 8-3331] design breath_led_ip_v1_0_S01_AXI has unconnected port S_AXI_AWPROT[1]
WARNING: [Synth 8-3331] design breath_led_ip_v1_0_S01_AXI has unconnected port S_AXI_AWPROT[0]
WARNING: [Synth 8-3331] design breath_led_ip_v1_0_S01_AXI has unconnected port S_AXI_ARPROT[2]
WARNING: [Synth 8-3331] design breath_led_ip_v1_0_S01_AXI has unconnected port S_AXI_ARPROT[1]
WARNING: [Synth 8-3331] design breath_led_ip_v1_0_S01_AXI has unconnected port S_AXI_ARPROT[0]
---------------------------------------------------------------------------------
Finished RTL Elaboration : Time (s): cpu = 00:00:03 ; elapsed = 00:00:03 . Memory (MB): peak = 524.770 ; gain = 151.809
---------------------------------------------------------------------------------

Report Check Netlist: 
+------+------------------+-------+---------+-------+------------------+
|      |Item              |Errors |Warnings |Status |Description       |
+------+------------------+-------+---------+-------+------------------+
|1     |multi_driven_nets |      0|        0|Passed |Multi driven nets |
+------+------------------+-------+---------+-------+------------------+
---------------------------------------------------------------------------------
Start Handling Custom Attributes
---------------------------------------------------------------------------------
---------------------------------------------------------------------------------
Finished Handling Custom Attributes : Time (s): cpu = 00:00:03 ; elapsed = 00:00:03 . Memory (MB): peak = 524.770 ; gain = 151.809
---------------------------------------------------------------------------------
---------------------------------------------------------------------------------
Finished RTL Optimization Phase 1 : Time (s): cpu = 00:00:03 ; elapsed = 00:00:03 . Memory (MB): peak = 524.770 ; gain = 151.809
---------------------------------------------------------------------------------
INFO: [Device 21-403] Loading part xc7z020clg484-2
INFO: [Project 1-570] Preparing netlist for logic optimization

Processing XDC Constraints
Initializing timing engine
Completed Processing XDC Constraints

Netlist sorting complete. Time (s): cpu = 00:00:00 ; elapsed = 00:00:00 . Memory (MB): peak = 865.316 ; gain = 0.000
INFO: [Project 1-111] Unisim Transformation Summary:
No Unisim elements were transformed.

Netlist sorting complete. Time (s): cpu = 00:00:00 ; elapsed = 00:00:00 . Memory (MB): peak = 865.316 ; gain = 0.000
WARNING: [Constraints 18-5210] No constraints selected for write.
Resolution: This message can indicate that there are no constraints for the design, or it can indicate that the used_in flags are set such that the constraints are ignored. This later case is used when running synth_design to not write synthesis constraints to the resulting checkpoint. Instead, project constraints are read when the synthesized design is opened.
Constraint Validation Runtime : Time (s): cpu = 00:00:00 ; elapsed = 00:00:00.049 . Memory (MB): peak = 868.195 ; gain = 2.879
---------------------------------------------------------------------------------
Finished Constraint Validation : Time (s): cpu = 00:00:09 ; elapsed = 00:00:10 . Memory (MB): peak = 868.195 ; gain = 495.234
---------------------------------------------------------------------------------
---------------------------------------------------------------------------------
Start Loading Part and Timing Information
---------------------------------------------------------------------------------
Loading part: xc7z020clg484-2
---------------------------------------------------------------------------------
Finished Loading Part and Timing Information : Time (s): cpu = 00:00:09 ; elapsed = 00:00:10 . Memory (MB): peak = 868.195 ; gain = 495.234
---------------------------------------------------------------------------------
---------------------------------------------------------------------------------
Start Applying 'set_property' XDC Constraints
---------------------------------------------------------------------------------
---------------------------------------------------------------------------------
Finished applying 'set_property' XDC Constraints : Time (s): cpu = 00:00:09 ; elapsed = 00:00:10 . Memory (MB): peak = 868.195 ; gain = 495.234
---------------------------------------------------------------------------------
INFO: [Synth 8-5546] ROM "duty_cycle" won't be mapped to RAM because it is too sparse
INFO: [Synth 8-5546] ROM "inc_dec_flag" won't be mapped to RAM because it is too sparse
---------------------------------------------------------------------------------
Finished RTL Optimization Phase 2 : Time (s): cpu = 00:00:09 ; elapsed = 00:00:10 . Memory (MB): peak = 868.195 ; gain = 495.234
---------------------------------------------------------------------------------

Report RTL Partitions: 
+-+--------------+------------+----------+
| |RTL Partition |Replication |Instances |
+-+--------------+------------+----------+
+-+--------------+------------+----------+
---------------------------------------------------------------------------------
Start RTL Component Statistics 
---------------------------------------------------------------------------------
Detailed RTL Component Info : 
+---Adders : 
	   2 Input     16 Bit       Adders := 1     
	   3 Input     16 Bit       Adders := 1     
+---Registers : 
	               32 Bit    Registers := 5     
	               16 Bit    Registers := 1     
	               10 Bit    Registers := 1     
	                4 Bit    Registers := 2     
	                2 Bit    Registers := 2     
	                1 Bit    Registers := 7     
+---Muxes : 
	   2 Input     32 Bit        Muxes := 4     
	   4 Input     32 Bit        Muxes := 5     
	   2 Input     16 Bit        Muxes := 2     
	   2 Input     10 Bit        Muxes := 2     
	   2 Input      1 Bit        Muxes := 10    
	   3 Input      1 Bit        Muxes := 2     
---------------------------------------------------------------------------------
Finished RTL Component Statistics 
---------------------------------------------------------------------------------
---------------------------------------------------------------------------------
Start RTL Hierarchical Component Statistics 
---------------------------------------------------------------------------------
Hierarchical RTL Component report 
Module breath_led 
Detailed RTL Component Info : 
+---Adders : 
	   2 Input     16 Bit       Adders := 1     
	   3 Input     16 Bit       Adders := 1     
+---Registers : 
	               16 Bit    Registers := 1     
	               10 Bit    Registers := 1     
	                1 Bit    Registers := 1     
+---Muxes : 
	   2 Input     16 Bit        Muxes := 2     
	   2 Input     10 Bit        Muxes := 2     
	   2 Input      1 Bit        Muxes := 5     
	   3 Input      1 Bit        Muxes := 2     
Module breath_led_ip_v1_0_S01_AXI 
Detailed RTL Component Info : 
+---Registers : 
	               32 Bit    Registers := 5     
	                4 Bit    Registers := 2     
	                2 Bit    Registers := 2     
	                1 Bit    Registers := 6     
+---Muxes : 
	   2 Input     32 Bit        Muxes := 4     
	   4 Input     32 Bit        Muxes := 5     
	   2 Input      1 Bit        Muxes := 5     
---------------------------------------------------------------------------------
Finished RTL Hierarchical Component Statistics
---------------------------------------------------------------------------------
---------------------------------------------------------------------------------
Start Part Resource Summary
---------------------------------------------------------------------------------
Part Resources:
DSPs: 220 (col length:60)
BRAMs: 280 (col length: RAMB18 60 RAMB36 30)
---------------------------------------------------------------------------------
Finished Part Resource Summary
---------------------------------------------------------------------------------
---------------------------------------------------------------------------------
Start Cross Boundary and Area Optimization
---------------------------------------------------------------------------------
Warning: Parallel synthesis criteria is not met 
WARNING: [Synth 8-3331] design system_breath_led_ip_0_0 has unconnected port s01_axi_awprot[2]
WARNING: [Synth 8-3331] design system_breath_led_ip_0_0 has unconnected port s01_axi_awprot[1]
WARNING: [Synth 8-3331] design system_breath_led_ip_0_0 has unconnected port s01_axi_awprot[0]
WARNING: [Synth 8-3331] design system_breath_led_ip_0_0 has unconnected port s01_axi_arprot[2]
WARNING: [Synth 8-3331] design system_breath_led_ip_0_0 has unconnected port s01_axi_arprot[1]
WARNING: [Synth 8-3331] design system_breath_led_ip_0_0 has unconnected port s01_axi_arprot[0]
INFO: [Synth 8-3886] merging instance 'inst/breath_led_ip_v1_0_S01_AXI_inst/axi_rresp_reg[0]' (FDRE) to 'inst/breath_led_ip_v1_0_S01_AXI_inst/axi_rresp_reg[1]'
INFO: [Synth 8-3333] propagating constant 0 across sequential element (\inst/breath_led_ip_v1_0_S01_AXI_inst/axi_rresp_reg[1] )
INFO: [Synth 8-3886] merging instance 'inst/breath_led_ip_v1_0_S01_AXI_inst/axi_bresp_reg[0]' (FDRE) to 'inst/breath_led_ip_v1_0_S01_AXI_inst/axi_bresp_reg[1]'
INFO: [Synth 8-3333] propagating constant 0 across sequential element (\inst/breath_led_ip_v1_0_S01_AXI_inst/axi_bresp_reg[1] )
---------------------------------------------------------------------------------
Finished Cross Boundary and Area Optimization : Time (s): cpu = 00:00:10 ; elapsed = 00:00:11 . Memory (MB): peak = 868.195 ; gain = 495.234
---------------------------------------------------------------------------------

Report RTL Partitions: 
+-+--------------+------------+----------+
| |RTL Partition |Replication |Instances |
+-+--------------+------------+----------+
+-+--------------+------------+----------+
---------------------------------------------------------------------------------
Start Applying XDC Timing Constraints
---------------------------------------------------------------------------------
---------------------------------------------------------------------------------
Finished Applying XDC Timing Constraints : Time (s): cpu = 00:00:15 ; elapsed = 00:00:17 . Memory (MB): peak = 874.938 ; gain = 501.977
---------------------------------------------------------------------------------
---------------------------------------------------------------------------------
Start Timing Optimization
---------------------------------------------------------------------------------
---------------------------------------------------------------------------------
Finished Timing Optimization : Time (s): cpu = 00:00:15 ; elapsed = 00:00:17 . Memory (MB): peak = 875.164 ; gain = 502.203
---------------------------------------------------------------------------------

Report RTL Partitions: 
+-+--------------+------------+----------+
| |RTL Partition |Replication |Instances |
+-+--------------+------------+----------+
+-+--------------+------------+----------+
---------------------------------------------------------------------------------
Start Technology Mapping
---------------------------------------------------------------------------------
---------------------------------------------------------------------------------
Finished Technology Mapping : Time (s): cpu = 00:00:15 ; elapsed = 00:00:17 . Memory (MB): peak = 896.086 ; gain = 523.125
---------------------------------------------------------------------------------

Report RTL Partitions: 
+-+--------------+------------+----------+
| |RTL Partition |Replication |Instances |
+-+--------------+------------+----------+
+-+--------------+------------+----------+
---------------------------------------------------------------------------------
Start IO Insertion
---------------------------------------------------------------------------------
---------------------------------------------------------------------------------
Start Flattening Before IO Insertion
---------------------------------------------------------------------------------
---------------------------------------------------------------------------------
Finished Flattening Before IO Insertion
---------------------------------------------------------------------------------
---------------------------------------------------------------------------------
Start Final Netlist Cleanup
---------------------------------------------------------------------------------
---------------------------------------------------------------------------------
Finished Final Netlist Cleanup
---------------------------------------------------------------------------------
---------------------------------------------------------------------------------
Finished IO Insertion : Time (s): cpu = 00:00:16 ; elapsed = 00:00:17 . Memory (MB): peak = 896.086 ; gain = 523.125
---------------------------------------------------------------------------------

Report Check Netlist: 
+------+------------------+-------+---------+-------+------------------+
|      |Item              |Errors |Warnings |Status |Description       |
+------+------------------+-------+---------+-------+------------------+
|1     |multi_driven_nets |      0|        0|Passed |Multi driven nets |
+------+------------------+-------+---------+-------+------------------+
---------------------------------------------------------------------------------
Start Renaming Generated Instances
---------------------------------------------------------------------------------
---------------------------------------------------------------------------------
Finished Renaming Generated Instances : Time (s): cpu = 00:00:16 ; elapsed = 00:00:17 . Memory (MB): peak = 896.086 ; gain = 523.125
---------------------------------------------------------------------------------

Report RTL Partitions: 
+-+--------------+------------+----------+
| |RTL Partition |Replication |Instances |
+-+--------------+------------+----------+
+-+--------------+------------+----------+
---------------------------------------------------------------------------------
Start Rebuilding User Hierarchy
---------------------------------------------------------------------------------
---------------------------------------------------------------------------------
Finished Rebuilding User Hierarchy : Time (s): cpu = 00:00:16 ; elapsed = 00:00:17 . Memory (MB): peak = 896.086 ; gain = 523.125
---------------------------------------------------------------------------------
---------------------------------------------------------------------------------
Start Renaming Generated Ports
---------------------------------------------------------------------------------
---------------------------------------------------------------------------------
Finished Renaming Generated Ports : Time (s): cpu = 00:00:16 ; elapsed = 00:00:17 . Memory (MB): peak = 896.086 ; gain = 523.125
---------------------------------------------------------------------------------
---------------------------------------------------------------------------------
Start Handling Custom Attributes
---------------------------------------------------------------------------------
---------------------------------------------------------------------------------
Finished Handling Custom Attributes : Time (s): cpu = 00:00:16 ; elapsed = 00:00:17 . Memory (MB): peak = 896.086 ; gain = 523.125
---------------------------------------------------------------------------------
---------------------------------------------------------------------------------
Start Renaming Generated Nets
---------------------------------------------------------------------------------
---------------------------------------------------------------------------------
Finished Renaming Generated Nets : Time (s): cpu = 00:00:16 ; elapsed = 00:00:17 . Memory (MB): peak = 896.086 ; gain = 523.125
---------------------------------------------------------------------------------
---------------------------------------------------------------------------------
Start Writing Synthesis Report
---------------------------------------------------------------------------------

Report BlackBoxes: 
+-+--------------+----------+
| |BlackBox name |Instances |
+-+--------------+----------+
+-+--------------+----------+

Report Cell Usage: 
+------+-------+------+
|      |Cell   |Count |
+------+-------+------+
|1     |CARRY4 |    16|
|2     |LUT1   |     8|
|3     |LUT2   |    48|
|4     |LUT3   |     7|
|5     |LUT4   |    61|
|6     |LUT5   |    12|
|7     |LUT6   |    42|
|8     |FDRE   |   212|
|9     |FDSE   |     1|
+------+-------+------+

Report Instance Areas: 
+------+------------------------------------+---------------------------+------+
|      |Instance                            |Module                     |Cells |
+------+------------------------------------+---------------------------+------+
|1     |top                                 |                           |   407|
|2     |  inst                              |breath_led_ip_v1_0         |   406|
|3     |    breath_led_ip_v1_0_S01_AXI_inst |breath_led_ip_v1_0_S01_AXI |   406|
|4     |      u_breath_led                  |breath_led                 |   176|
+------+------------------------------------+---------------------------+------+
---------------------------------------------------------------------------------
Finished Writing Synthesis Report : Time (s): cpu = 00:00:16 ; elapsed = 00:00:17 . Memory (MB): peak = 896.086 ; gain = 523.125
---------------------------------------------------------------------------------
Synthesis finished with 0 errors, 0 critical warnings and 6 warnings.
Synthesis Optimization Runtime : Time (s): cpu = 00:00:09 ; elapsed = 00:00:12 . Memory (MB): peak = 896.086 ; gain = 179.699
Synthesis Optimization Complete : Time (s): cpu = 00:00:16 ; elapsed = 00:00:18 . Memory (MB): peak = 896.086 ; gain = 523.125
INFO: [Project 1-571] Translating synthesized netlist
INFO: [Netlist 29-17] Analyzing 16 Unisim elements for replacement
INFO: [Netlist 29-28] Unisim Transformation completed in 0 CPU seconds
INFO: [Project 1-570] Preparing netlist for logic optimization
INFO: [Opt 31-138] Pushed 0 inverter(s) to 0 load pin(s).
Netlist sorting complete. Time (s): cpu = 00:00:00 ; elapsed = 00:00:00 . Memory (MB): peak = 898.004 ; gain = 0.000
INFO: [Project 1-111] Unisim Transformation Summary:
No Unisim elements were transformed.

INFO: [Common 17-83] Releasing license: Synthesis
30 Infos, 13 Warnings, 0 Critical Warnings and 0 Errors encountered.
synth_design completed successfully
synth_design: Time (s): cpu = 00:00:17 ; elapsed = 00:00:20 . Memory (MB): peak = 898.004 ; gain = 536.523
Netlist sorting complete. Time (s): cpu = 00:00:00 ; elapsed = 00:00:00 . Memory (MB): peak = 898.004 ; gain = 0.000
WARNING: [Constraints 18-5210] No constraints selected for write.
Resolution: This message can indicate that there are no constraints for the design, or it can indicate that the used_in flags are set such that the constraints are ignored. This later case is used when running synth_design to not write synthesis constraints to the resulting checkpoint. Instead, project constraints are read when the synthesized design is opened.
INFO: [Common 17-1381] The checkpoint 'C:/Users/Admin/Desktop/VIVADO_Projects/PS/ip/user_led.runs/system_breath_led_ip_0_0_synth_1/system_breath_led_ip_0_0.dcp' has been generated.
INFO: [Coretcl 2-1648] Added synthesis output to IP cache for IP system_breath_led_ip_0_0, cache-ID = 597ca9ed0e298607
INFO: [Coretcl 2-1174] Renamed 3 cell refs.
Netlist sorting complete. Time (s): cpu = 00:00:00 ; elapsed = 00:00:00 . Memory (MB): peak = 898.004 ; gain = 0.000
WARNING: [Constraints 18-5210] No constraints selected for write.
Resolution: This message can indicate that there are no constraints for the design, or it can indicate that the used_in flags are set such that the constraints are ignored. This later case is used when running synth_design to not write synthesis constraints to the resulting checkpoint. Instead, project constraints are read when the synthesized design is opened.
INFO: [Common 17-1381] The checkpoint 'C:/Users/Admin/Desktop/VIVADO_Projects/PS/ip/user_led.runs/system_breath_led_ip_0_0_synth_1/system_breath_led_ip_0_0.dcp' has been generated.
INFO: [runtcl-4] Executing : report_utilization -file system_breath_led_ip_0_0_utilization_synth.rpt -pb system_breath_led_ip_0_0_utilization_synth.pb
INFO: [Common 17-206] Exiting Vivado at Wed Nov 26 20:46:54 2025...
